<xs:schema attributeFormDefault="unqualified" elementFormDefault="qualified" targetNamespace="assign1" xmlns:xs="http://www.w3.org/2001/XMLSchema">
   
  
  <xs:element name="polls">
    <xs:complexType>
      <xs:sequence>
        <xs:element name="poll" maxOccurs="unbounded" minOccurs="0">
          <xs:complexType>
            <xs:sequence>
              <xs:element type="xs:string" name="title"/>
              <xs:element type="xs:int" name="state"/>
              <xs:element type="xs:int" name="userID"/>
              <xs:element type="xs:string" name="datecreated"/>
              <xs:element type="xs:string" name="location"/>
              <xs:element type="xs:string" name="description"/>
              <xs:element name="meetings">
                <xs:complexType mixed="true">
                  <xs:sequence>
                    <xs:element name="meeting" maxOccurs="unbounded" minOccurs="1">
                      <xs:complexType>
                        <xs:sequence>
                          <xs:element type="xs:string" name="time"/>
                          <xs:element type="xs:string" name="date"/>
                          <xs:element name="responses">
                            <xs:complexType mixed="true">
                              <xs:sequence>
                                <xs:element type="xs:string" name="response" maxOccurs="unbounded" minOccurs="0"/>
                              </xs:sequence>
                            </xs:complexType>
                          </xs:element>
                        </xs:sequence>
                        <xs:attribute type="xs:int" name="option" use="optional"/>
                      </xs:complexType>
                    </xs:element>
                  </xs:sequence>
                </xs:complexType>
              </xs:element>
            </xs:sequence>
            <xs:attribute type="xs:int" name="id" use="optional"/>
          </xs:complexType>
        </xs:element>
      </xs:sequence>
    </xs:complexType>
  </xs:element>
</xs:schema>